{
  "version": "1.0",
  "description": "Profils de sites pour filtrage intelligent des règles Opquast",
  "profiles": {
    "e-commerce": {
      "name": "Site E-Commerce",
      "description": "Boutique en ligne avec catalogue produits et paiement",
      "detection": {
        "keywords": [
          "panier",
          "cart",
          "checkout",
          "add to cart",
          "ajouter au panier",
          "prix",
          "price",
          "€",
          "$",
          "acheter",
          "buy",
          "shop"
        ],
        "elements": [
          "[data-product]",
          ".product",
          ".cart",
          ".checkout",
          "[itemtype*='Product']",
          "form[action*='cart']"
        ],
        "urls": [
          "/cart",
          "/panier",
          "/checkout",
          "/product",
          "/produit",
          "/shop",
          "/boutique"
        ],
        "meta": [
          "og:type=product",
          "product:price"
        ]
      },
      "rubriques_prioritaires": [
        "E-Commerce",
        "Formulaires",
        "Sécurité",
        "Données personnelles"
      ],
      "regles_critiques": [
        30,
        31,
        32,
        33,
        34,
        35,
        36,
        37,
        38,
        39,
        40,
        41,
        42,
        59,
        61,
        62,
        63,
        64,
        65,
        197,
        198,
        199,
        200
      ],
      "regles_exclues": [],
      "pages_a_analyser": [
        "accueil",
        "produit",
        "panier",
        "checkout",
        "compte",
        "cgv",
        "mentions-legales",
        "confidentialite"
      ]
    },
    "saas": {
      "name": "Application SaaS",
      "description": "Service en ligne avec authentification et espace utilisateur",
      "detection": {
        "keywords": [
          "login",
          "sign in",
          "connexion",
          "dashboard",
          "tableau de bord",
          "account",
          "compte",
          "subscription",
          "abonnement",
          "pricing",
          "tarifs"
        ],
        "elements": [
          "[data-dashboard]",
          ".dashboard",
          "form[action*='login']",
          ".pricing-table",
          "[data-user]"
        ],
        "urls": [
          "/login",
          "/signin",
          "/dashboard",
          "/account",
          "/pricing",
          "/app"
        ],
        "meta": [
          "og:type=website"
        ]
      },
      "rubriques_prioritaires": [
        "Données personnelles",
        "Sécurité",
        "Formulaires",
        "Navigation"
      ],
      "regles_critiques": [
        15,
        16,
        17,
        18,
        19,
        20,
        21,
        22,
        23,
        25,
        26,
        27,
        28,
        29,
        75,
        76,
        197,
        198,
        199,
        200,
        201,
        202,
        203,
        204
      ],
      "regles_exclues": [
        30,
        31,
        32,
        33,
        34,
        35,
        36,
        43,
        45,
        46,
        47,
        48,
        53,
        57,
        58,
        64,
        65,
        66,
        67,
        68
      ],
      "pages_a_analyser": [
        "accueil",
        "pricing",
        "login",
        "signup",
        "dashboard",
        "compte",
        "mentions-legales",
        "confidentialite"
      ]
    },
    "vitrine": {
      "name": "Site Vitrine",
      "description": "Site de présentation d'entreprise ou de service",
      "detection": {
        "keywords": [
          "contact",
          "à propos",
          "about",
          "nos services",
          "our services",
          "qui sommes-nous",
          "équipe",
          "team"
        ],
        "elements": [
          "form[action*='contact']",
          ".about",
          ".services",
          ".team",
          "[itemtype*='Organization']"
        ],
        "urls": [
          "/contact",
          "/about",
          "/a-propos",
          "/services",
          "/equipe"
        ],
        "meta": [
          "og:type=website"
        ]
      },
      "rubriques_prioritaires": [
        "Identification et contact",
        "Contenus",
        "Navigation",
        "Structure et code"
      ],
      "regles_critiques": [
        93,
        94,
        95,
        96,
        97,
        98,
        99,
        100,
        101,
        102,
        103,
        104,
        105,
        106,
        107,
        108,
        109,
        144,
        145,
        146,
        147,
        148
      ],
      "regles_exclues": [
        30,
        31,
        32,
        33,
        34,
        35,
        36,
        37,
        38,
        39,
        40,
        41,
        42,
        43,
        44,
        45,
        46,
        47,
        48,
        49,
        50,
        51,
        52,
        53,
        54,
        55,
        56,
        57,
        58,
        59,
        60,
        61,
        62,
        63,
        64,
        65,
        66,
        67,
        68
      ],
      "pages_a_analyser": [
        "accueil",
        "contact",
        "a-propos",
        "services",
        "mentions-legales"
      ]
    },
    "blog": {
      "name": "Blog / Média",
      "description": "Site éditorial avec articles et contenus",
      "detection": {
        "keywords": [
          "article",
          "blog",
          "post",
          "actualités",
          "news",
          "publié le",
          "published",
          "auteur",
          "author",
          "catégorie",
          "category"
        ],
        "elements": [
          "article",
          "[itemtype*='Article']",
          "[itemtype*='BlogPosting']",
          ".post",
          ".article",
          "time[datetime]"
        ],
        "urls": [
          "/blog",
          "/article",
          "/news",
          "/actualites",
          "/category",
          "/tag"
        ],
        "meta": [
          "og:type=article",
          "article:published_time"
        ]
      },
      "rubriques_prioritaires": [
        "Contenus",
        "Navigation",
        "Structure et code",
        "Liens"
      ],
      "regles_critiques": [
        1,
        2,
        3,
        4,
        5,
        6,
        7,
        8,
        9,
        12,
        14,
        144,
        145,
        146,
        147,
        148,
        149,
        150,
        151,
        152,
        219,
        220,
        221,
        222,
        223
      ],
      "regles_exclues": [
        30,
        31,
        32,
        33,
        34,
        35,
        36,
        37,
        38,
        39,
        40,
        41,
        42,
        43,
        44,
        45,
        46,
        47,
        48,
        49,
        50,
        51,
        52,
        53,
        54,
        55,
        56,
        57,
        58,
        59,
        60,
        61,
        62,
        63,
        64,
        65,
        66,
        67,
        68
      ],
      "pages_a_analyser": [
        "accueil",
        "article",
        "categorie",
        "contact",
        "a-propos",
        "mentions-legales"
      ]
    },
    "institutionnel": {
      "name": "Site Institutionnel / Public",
      "description": "Site d'administration, collectivité ou organisation publique",
      "detection": {
        "keywords": [
          "mairie",
          "commune",
          "région",
          "département",
          "ministère",
          "administration",
          "service public",
          "démarches",
          "formulaires administratifs"
        ],
        "elements": [
          "[itemtype*='GovernmentOrganization']",
          ".demarches",
          ".services-publics"
        ],
        "urls": [
          "/demarches",
          "/services",
          "/annuaire",
          "/deliberations"
        ],
        "meta": []
      },
      "rubriques_prioritaires": [
        "Identification et contact",
        "Formulaires",
        "Navigation",
        "Contenus",
        "Présentation"
      ],
      "regles_critiques": [
        69,
        70,
        71,
        72,
        73,
        74,
        75,
        76,
        77,
        78,
        79,
        80,
        81,
        82,
        83,
        84,
        85,
        86,
        87,
        88,
        89,
        90,
        91,
        92,
        93,
        94,
        95,
        96,
        97,
        98,
        181,
        182,
        183,
        184,
        185,
        186
      ],
      "regles_exclues": [
        30,
        31,
        32,
        33,
        34,
        35,
        36,
        37,
        38,
        39,
        40,
        41,
        42,
        43,
        44,
        45,
        46,
        47,
        48,
        49,
        50,
        51,
        52,
        53,
        54,
        55,
        56,
        57,
        58,
        59,
        60,
        61,
        62,
        63,
        64,
        65,
        66,
        67,
        68
      ],
      "pages_a_analyser": [
        "accueil",
        "contact",
        "demarches",
        "annuaire",
        "mentions-legales",
        "accessibilite"
      ]
    },
    "newsletter": {
      "name": "Site avec Newsletter",
      "description": "Site proposant une inscription newsletter",
      "detection": {
        "keywords": [
          "newsletter",
          "inscription",
          "subscribe",
          "s'abonner",
          "email",
          "recevoir nos",
          "restez informé"
        ],
        "elements": [
          "form[action*='newsletter']",
          "form[action*='subscribe']",
          "[data-newsletter]",
          ".newsletter",
          "input[name*='newsletter']"
        ],
        "urls": [
          "/newsletter",
          "/subscribe"
        ],
        "meta": []